{
  "id":"urn:receipt:123e4567",
  "issued_at":"2025-09-08T10:00:00Z",
  "model_version":"vendor:model@2025-09-01",
  "policy_version":"trust:standard@1.0",
  "policy_hash":"sha256:aaaaaaaaaaaaaaaaaaaaaaaaaaaaaaaaaaaaaaaaaaaaaaaaaaaaaaaaaaaaaaaa",
  "input_hash":"sha256:bbbbbbbbbbbbbbbbbbbbbbbbbbbbbbbbbbbbbbbbbbbbbbbbbbbbbbbbbbbbbbbb",
  "output_hash":"sha256:cccccccccccccccccccccccccccccccccccccccccccccccccccccccccccccccc",
  "timestamp":"2025-09-08T10:00:05Z",
  "proof_refs":[{"type":"ANCHOR","network":"sepolia","tx":"0xabc123","finality_level":"soft"}],
  "trustscore":92,
  "signature":"did:web:example.org#key-1 sig..."
}
